{"id": "077", "title": "Yelling takes Cardiff hat-trick", "labels": {"NORP": ["European", "Irish"], "PERSON": ["Hayley Yelling", "Jolene Byrne", "Louise Damen", "Peter Riley", "Gary Murray", "Glynn Tromans"], "ORG": ["the Reebok Cardiff Cross Challenge", "European Championships", "Riley", "UK Inter-Countries", "England Cross-Country"], "LOC": ["Bute Park"], "DATE": ["Sunday", "last month's", "five-month"], "TIME": ["afternoon"], "QUANTITY": ["40 metres", "six-kilometre", "9km", "two kilometres", "25 metres"], "GPE": ["Great Britain", "England", "GB", "Ireland"], "ORDINAL": ["third"]}, "text": ["European cross-country champion Hayley Yelling completed a hat-trick of wins in the Reebok Cardiff Cross Challenge in Bute Park on Sunday afternoon.", "The part-time maths teacher beat Irish international Jolene Byrne by 40 metres in the six-kilometre race. Another Great Britain international, Louise Damen, finished third as part of the contingent representing England. Peter Riley, who secured bronze for the GB men's team at last month's European Championships, won the men's 9km race. Riley, representing England, moved away over the last two kilometres to win by 25 metres from Ireland's Gary Murray. Glynn Tromans - the reigning UK Inter-Countries and England Cross-Country champion - came in third place as he continues his comeback from a five-month injury lay-off."]}